artist,song,lyrics,genres,genre_1,genre_2,genre_3
Van Morrison,Saint Dominic's Preview,"Chambois, cleaning all the windows

Singin' songs about Edith Piaf's soul

And I hear blue strains of ""No Regredior""

Across the street from cathedral Notre Dame



Meanwhile, back in San Francisco

We're tryin' hard to make this whole thing blend

As we sit upon this jagged

Story block, with you, my friend



And it's a long way to Buffalo

It's a long way to Belfast city, too

And I'm hopin' the joist won't blow the hoist

'Cause this time, they bit off more than they could chew



As we gaze out on, as we gaze out on

As we gaze out on, as we gaze out on, yeah

Saint Dominic's preview

Saint Dominic's preview

Saint Dominic's preview



All the orange boxes are scattered

Against the Safeway supermarket in the rain

And everybody feels so determined

Not to feel anyone else's pain



No one makin' no commitments

To anybody but themselves

Talkin' behind closed doorways

Tryin' to get outside, get outside of empty shell



And for every cross-cuttin' county corner, country corner

For every Hank Williams railroad train that cried

And all the chains, badges, flags, and emblems

And every strain on brain and every eye



As we gaze out on, as we gaze out on

As we gaze out on, as we gaze out on

Saint Dominic's preview

I look at them, man

Saint Dominic's preview

Look at the band

Saint Dominic's preview



All the restaurant tables are completely covered

And the record company has paid out for the wine

You got everything in the world you ever wanted

And right about now, your face should wear a smile, do you know that?

That's the way it all should happen

When you're in, when you're in the state you're in

And you got your pen and notebook ready

I think it's about time, time for us to begin



And meanwhile, we're over on a 52nd Street apartment

Socializin' with the white hope few

Just to be hip, and get wet with the jet set

But they was flyin' too high to see my point of view



As we gaze out on, as we gaze out on

As we gaze out on, as we gaze out on

Saint Dominic's preview

Look at them, man

Saint Dominic's preview

Look at the band

Saint Dominic's preview

Set them freedom marchin'

(Saint Dominic's preview)

Out in the street, freedom marchin'

(Saint Dominic's preview)

Out in the street

Look at them, man

(Saint Dominic's preview)

Turn around

(Saint Dominic's preview)

Come back, come back

(Saint Dominic's preview)

Turn around

And look at them, man

(Saint Dominic's preview)

Said, hold on

Saint Dominic's preview

Hey, hey, Saint Dominic's preview

To soul me in

Saint Dominic's preview","singer-songwriter, classic rock, rock",singer-songwriter,classic rock,rock
Van Morrison,Twist And Shake,,"acoustic, classic rock, singer-songwriter",acoustic,classic rock,singer-songwriter
Beirut,The Gulag Orkestra,,"folk, indie, indie folk",folk,indie,indie folk
Regina Spektor,Love Affair,"There was a love affair in this building

The kind of love affair

Which every respectable building must keep as a legend



Slowly festering through an innocent ""by the way""

Or ""have you heard?""

He was perfect except for the fact that he was an engineer

And mothers prefer doctors

And lawyers



Yet despite this imperfection

He was clean-looking and respectable-looking

And you'll never find a mother

Who doesn't appreciate a natural man



So he grew healthy aloe vera plants by the window

Healthy teeth in his mouth

Healthy hair on his head

He grew healthy wavy brown hair on his head

The kind, the kind that babies always go for

With sticky little fingers","piano, regina spektor, female vocalists",piano,regina spektor,female vocalists
